<?xml version="1.0" encoding="ISO-8859-1" ?>
<attacks xmlns:xsi="http://www.w3.org/2001/XMLSchema-instance"
		xsi:noNamespaceSchemaLocation="attacks.xsd">
	<attack>
		<name>raw</name>
		<display-name>Tag Based</display-name>
		<attack-string>&lt;script&gt;x()&lt;/script&gt;</attack-string>
	</attack>
	<attack>
		<name>css</name>
		<display-name>CSS Based</display-name>
		<attack-string>c:expression(x());</attack-string>
	</attack>
	<attack>
		<name>quote_attribute</name>
		<display-name>Quote Attribute Based</display-name>
		<attack-string>&quot; onmouseover=&quot;x()</attack-string>
	</attack>
	<attack>
		<name>apos_attribute</name>
		<display-name>Apostrophe Attribute Based</display-name>
		<attack-string>' onmouseover='x()</attack-string>
	</attack>	
	<attack>
		<name>url</name>
		<display-name>URL Based</display-name>
		<attack-string>javascript:x()</attack-string>
	</attack>
	<attack>
		<name>event</name>
		<display-name>Event Based</display-name>
		<attack-string>x()</attack-string>
	</attack>
</attacks>